name,tradition,rank,focus,target,range,properties,effect,heightened
Law of the Strongest,Nature,2,4,Hard (10),Medium,"enchant (body),  singular","You fill a creature‘s body with empowering nature magic. The target has to be a creature of medium or smaller Size. On a success, the target‘s body grows one Size larger along with all of their worn equipment and held items (as long as they stay in contact with their body). While enlarged by this spell, they gain the following effects: - Gain 5 temporary HP. - Gain +1 boon on Strength rolls. - You gain +1 Parry and lose -1 Dodge. - You gain +1 AV. - You deal +2 damage with attacks based on Strength. This spell lasts for a short duration or until the target falls unconscious.   > **Heightened**   <strong>(Rank 3)</strong> The target gains the following effects instead: - Gain 10 temporary HP. - Gain +1 boon on Strength rolls. - You gain +2 Parry and lose -2 Dodge. - You gain +2 AV. - You deal +4 damage with attacks based on Strength.  >",-
Living Plants,Nature,2,4,Hard (10),Medium,concentrate,"You manipulate nearby plants to grow rapidly and attack your enemies or form structures. Choose any location in range. On a success, plants grow and animate under your control, filling an area close to the target location. You can command the plants to perform one of the following abilities during each of your turns:  <strong>Attack.</strong> Target any number of creatures in the area and use your roll's result vs. their Dodge. Deal +2/+4/+6 damage against each target.  <strong>Restrain. </strong>Target any number of creatures in the area and use your roll's result vs. their Dodge. On a success, each target is grappled. On a strong or critical success, each target is grappled and restrained. If you choose any other ability during one of your turns, this ability ends.  <strong>Shape. </strong>Form the plants into a simple structure (such as a shelter, bridge, or barrier). The structure is solid and provides cover. If you end the spell while the plants are shaped, the shape remains stable for a long duration, after which the plants wither and decay. The plants last for a medium duration or until you dismiss them.   > **Heightened**   <strong>(Rank 3) </strong>Choose one: - The plants fill in short range of the target location. - The plants deal +4/+8/+12 damage with attacks instead.  >",-
Melt Ground,Nature,2,4,Hard (10),Medium,concentrate,"You cause the ground in the target area to become soft and muddy, creating a natural trap. On a success, the ground in an area close to the target location becomes muddy and creatures sink slightly into it. The muddy area is difficult terrain. Also, when any creature attempts to move though the muddy area for the first time during their turn, they have to first succeed on a Strength + Athletics test vs. this spell’s target Difficulty. If they fail, their Movement becomes 0 for the rest of the turn. This spell lasts for a medium duration.   > **Heightened**   <strong>(Rank 3) </strong>The affected area extends to medium range from the target location instead. >",-
Nature’s Passage,Nature,2,4,Hard (10),Self,concentrate,"You conjure up an aura around you, gently warping plants and vegetation in your vicinity as you move. On a success, apply the following effects: - You can Dash as a Quick Action on your turns. - Any difficult terrain in short distance of you temporarily becomes normal terrain. - You gain +1 boon on Navigation rolls during travel. This spell lasts for a long duration.",-
Rock Skin,Nature,2,4,Hard (10),Medium,"enchant (body),  singular","You create a protective shell of hardened rock plates around a creature within range. On a success, the creature gains the following effects: - The rock plates absorbs any non-psychic damage inflicted on you. When the rock plates have absorbed a total of 20 HP, they break and the spell ends. - Your unarmed attacks deal +2 damage. - You gain +1 Parry and lose -1 Dodge. - You can’t use more than 1 Movement per turn.   > **Heightened**   <strong>(Rank 3)</strong> The target gains the following effects instead: - The rock plates absorbs any non-psychic damage inflicted on you. When the rock plates have absorbed a total of 30 HP, they break and the spell ends. - Your unarmed attacks deal +4 damage. - You gain +1 Parry and lose -1 Dodge. - You can’t use more than 1 Movement per turn.  >",-
Speak with Animals and Plants,Nature,2,4,Hard (10),Close,-,"You attune yourself to the natural consciousness of nearby flora and fauna, allowing communication. On a success, you can understand and speak with animals and plants within range. Plants have limited perception and knowledge, typically aware only of events in their immediate vicinity involving weather, other plants, and obvious physical interactions. Animals are more perceptive but have limited intelligence and memory. You can ask each individual plant or friendly animal three questions, which they will answer to the best of their ability. Answers are filtered through the creature's perspective and intelligence. A plant might recall a person passing by but not their face. A bird might remember colorful clothing but not what was said. Any non-friendly animal will not be beholden to answer any of your questions. This spell lasts for a medium duration.",-
Sudden Growth,Nature,2,4,Hard (10),Medium,-,"You dramatically accelerate the growth of plant life in the target area. On a success, choose one of the following effects:  <strong>Barrier.</strong> Create a wall of tough plants which covers a close distance in width and height. The barrier has 20 HP, 2 AV (Light), 8 Defense, and provides cover. Climbing the barrier requires a Strength + Athletics roll.  <strong>Platform.</strong> Create a stable platform of intertwined branches covering up to a close area that can support creature with medium Size or smaller. The platform can grow up to a short distance above ground level. Any creatures standing on the space where the branches grow into the air are safely lifted up with it. For damaging the platform, use the same statistics as for the Barrier option.  <strong>Harvest.</strong> Magically fertilize soil within medium range of the target area. Any fruit, vegetable, or other crop on that soil will be immune against disease and grow twice as fast. When you choose Barrier or Platform, the plants remain for a short duration. If you choose Harvest, the effect remains until the plants are fully grown.   > **Heightened**   <strong>(Rank 3)</strong> Apply these effects for each option:  <strong>Barrier. </strong>The wall can cover up to a short distance in width and height instead. It also has 30 HP and 4 AV instead.  <strong>Platform. </strong>The platform can grow up to a medium distance above ground level instead.  <strong>Harvest.</strong> Fertilize soil within long range of the target area instead. >",-
Thorn Barrage,Nature,2,4,vs. Dodge,Medium,blast (line),You launch a volley of magically-created thorns that tear through multiple targets in a line. Target all creatures in a straight line from you up to a target point within range. <strong>Weak.</strong> Deal +4 damage to each target. <strong>Strong.</strong> Deal +8 damage to each target and they are bleeding (2). <strong>Critical.</strong> Deal +12 damage to each target and they are bleeding (4).  > **Heightened**   <strong>(Rank 3)</strong> Choose one: - Deal +6/+12/+18 damage to each target and inflict bleeding (-/4/6) instead. - Increase the spell‘s range to long.  >,-
Toxic Mist,Nature,2,4,vs. Dodge,Short,blast (cone),You create a cone of toxic fog that spreads from your position. Target all creatures within the spell’s area. <strong>Weak.</strong> Deal +4 poison damage (ignoring 1/2 AV) to each target. <strong>Strong.</strong> Deal +8 poison damage (ignoring 1/2 AV) to each target and they are poisoned for a short duration. <strong>Critical.</strong> Deal +12 poison damage (ignoring 1/2 AV) to each target and they are poisoned for a short duration.  > **Heightened**   <strong>(Rank 3)</strong> Choose one: - Deal +6/+12/+18 poison damage (ignoring 1/2 AV) to each target instead. - Increase the spell’s range to medium.  >,-
Water Prison,Nature,2,4,vs. Dodge,Short,concentrate,"You conjure a sphere of water that engulfs and traps a target of up to medium Size, causing them to begin drowning. On a success, the target is grappled and restrained by the sphere of water and suffocating until they escape. This spell lasts for a short duration.   > **Heightened**   <strong>(Rank 3) </strong>You can target a creature of up to large Size instead. >",-
Animal Messenger,Nature,3,6,Very Hard (12),Touch,singular,"You enchant a small, friendly animal to carry a message for you. On a success, you can send a small animal (such as a bird, squirrel, or rat) to a specific recipient or location you know within one day’s distance. You must have personally seen the recipient or location at least once. You can attach a small physical object with low weight to the animal or have it memorize a spoken message of up to 25 words. The animal will travel at its normal speed but with supernatural determination and direction sense. It will attempt to deliver the message or item directly to the intended recipient, waiting up to one day for a good opportunity.",-
Fungal Growth,Nature,3,6,Very Hard (12),Medium,singular,"You cause a rapid eruption of psychoactive fungi in the target area. On a success, magical mushrooms sprout throughout an area close to the target location. The area becomes difficult terrain and is filled with hallucinogenic spores. Any creature that starts its turn in the area or enters it for the first time on its turn must succeed on a Spirit + Fortitude roll vs. your Resist or become briefly confused. The fungi remain for up to a medium duration and even if you move out of range of the area.",-
Impalement,Nature,3,6,vs. Dodge,Long,-,You cause a massive stone spike to erupt from the ground beneath your target. <strong>Weak.</strong> Deal +6 damage (ignoring 1/2 AV) to the target. <strong>Strong.</strong> Deal +12 damage (ignoring 1/2 AV) to the target and they are pushed up to a short distance upward or away from you. <strong>Critical.</strong> Deal +18 damage (ignoring 1/2 AV) to the target and they are pushed up to a short distance upward or away from you.,-
Insect Swarm,Nature,3,6,Very Hard (12),Long,concentrate,"You summon a dense cloud of biting and stinging insects that fill an area within short range from the target location. On a success, the insect swarm appears and attacks all creatures within the area that you choose. Use your roll’s result vs. their Dodge. On a success, each target takes +4 damage (ignoring 1/2 AV) and is briefly distracted by the insects. On each of your following turns, you can repeat the roll vs. Dodge against any amount of creatures within the swarm’s area to repeat the spell’s effect. Before or after the roll, you can choose to move the swarm a short distance within range. The swarm is immune against attacks but if they would suffer any amount of fire damage, roll a Concentration test for this spell as if you took that damage. The swarm remains for a short duration.",-
Life from Stone,Nature,3,6,Very Hard (12),Long,concentrate,"You infuse a large or smaller object or structure made from stone or wood with primal energy, bringing it to life as a construct. On a success, the target object animates and becomes a creature under your control with statistics equal to a Tier 3 companion with the Size of the original object. In addition, use the following traits for it:  <strong>HP</strong>. +10 HP  <strong>AV.</strong> + Tier (natural Heavy)  <strong>Attributes.</strong> +1d Strength, -1d Agility  <strong>Defenses.</strong> +1 Parry, -1 Dodge  <strong>Skills.</strong> Fighting (-1 rank), Fortitude  <strong>Immunities.</strong> poison damage, poisoned, bleeding, prone, unconscious  <strong>Resistances.</strong> psychic  <strong>Weaknesses.</strong> blast  <strong>Attacks</strong> - Slam (<em>crush</em>). On a strong or critical hit, the target falls prone. The construct remains animated for a short duration, until dismissed by you, or until it’s HP are reduced to 0.",-
Nature's Judgment,Nature,3,6,vs. Resist,Medium,concentrate,"You mark a creature with a primal stigma, causing nature itself to turn against them. On a success, the target is marked by your primal magic. While marked, the target suffers the following effects: - Plants within medium range of the target actively hamper its movement, making all natural terrain difficult terrain for them. - The target suffers +1 bane on all Strength and Agility rolls as branches snag, roots trip, and stones shift underfoot. - Any animal not friendly towards the creature is automatically hostile towards them. If an animal is friendly towards them, they have to roll Spirit + Fortitude against your Resist. If they fail, they also turn hostile against the marked target. All hostile animals gain +1 boon on attacks against them. - The target cannot benefit from cover provided by natural materials (such as trees, bushes, or stones). The mark lasts for up to a medium duration.",-
Petrification,Nature,3,6,vs. Resist,Short,concentrate,"You turn a creature into inanimate stone. The target has to be of a tier equal to or lower than your Mysticism. If the creature is at full HP, you suffer +1 bane on the roll. On a success, the target starts to turn to stone and is stunned. At the end of their next turn, repeat the roll for this spell. If you succeed, the petrification continues and they are now paralyzed. At the end of their turn after that, repeat the roll for this spell again. If you succeed again, they are fully petrified. A petrified creature is paralyzed and unconscious. A petrified creature also has 10 AV (Heavy natural armor) unless they had more AV normally. The creature remains petrified while you remain concentrated on the spell. When the creature takes damage during this time, make a Concentration roll as if you took the same amount of damage. After a medium duration concentrating on this spell, the petrification becomes permanent and has to be lifted by an effect that can break curses or petrification (for example, the Break Curse spell or a Potion of Stone to Flesh).",-
Control Weather,Nature,4,8,Extreme (14),Extreme,concentrate,TODO: <em>change the weather on a large scale</em>,-
Tree Stride,Nature,4,8,Extreme (14),Extreme,-,TODO: Step into one tree and emerge from another within range,-
Gust,Tempest,0,0,vs. Dodge,Short,-,"You summon a vortex of swirling air, clashing against your target and pulling them off their feet. <strong>Weak.</strong> Deal +2 blast damage. <strong>Strong.</strong> Deal +4 blast damage and push the target close. <strong>Critical.</strong> Deal +6 blast damage and push the target a short distance. You can also cast this spell to create a continuous stream of air from your palm that has enough pressure to move small, loose objects in range.",-
Static Shock,Tempest,0,0,vs. Dodge,Medium,-,"You generate a small electric discharge from your fingertip against a target. <strong>Weak.</strong> Deal +2 lightning damage. <strong>Strong. </strong>Deal +4 lightning damage to the target and you can deal +2 lightning damage to one other creature in melee range of the target. <strong>Critical. </strong>Deal +6 lightning damage to the target and you can deal +4 lightning damage to one other creature in melee range of the target. You can also cast this spell to ignite flammable materials in range, such as tinder or straw.",-
Wind Slash,Tempest,0,0,vs. Dodge,Medium,-,Hurl a blade of compressed air against your target. <strong>Weak.</strong> Deal +0 damage or +4 damage against a target in light or no armor. <strong>Strong.</strong> Deal +2 damage or +6 damage against a target in light or no armor. <strong>Critical.</strong> Deal +4 damage or +8 damage against a target in light or no armor. You can also use this spell to chip off or cut parts of softer materials such as wood or papyrus in range.,-
Bursting Crackle,Tempest,1,2,vs. Resist,Medium,-,"You gather an electric charge at a single point within range and release it with a powerful blast, creating loud thunder. Target all creatures in melee range of the target location. <strong>Weak.</strong> Deal +2 blast damage (ignoring 1/2 AV) against each target. <strong>Strong.</strong> Deal +4 blast damage (ignoring 1/2 AV) against each target and they are briefly dazed and deafened. <strong>Critical.</strong> Deal +6 blast damage (ignoring 1/2 AV) against each target and they are briefly dazed and deafened.  > **Heightened**   <strong>(Rank 2)</strong> Choose one: - Deal +4/+8/+12 blast damage to each target instead. - Target all creatures in close range of the target location instead. <strong>(Rank 3)</strong> Choose one: - Deal +6/+12/+18 blast damage to each target instead. - Target all creatures in short range of the target location instead.  >",-
Curse of Tempest,Tempest,1,2,vs. Resist,Short,singular,"You curse a creature with the magical power of tempest, turning nature itself against them. On a success, the creature suffers the following effects: - While moving in natural environments, it is always considered difficult terrain for them. - They suffer +1 bane on Athletics and Survival rolls. This curse lasts for a long duration.   > **Heightened**   <strong>(Rank 2)</strong> The target suffers a weakness to blast, fire, or lightning damage (choose one) for the spell‘s duration. <strong>(Rank 3)</strong> The target suffers a weakness to blast, fire, and lightning damage for the spell‘s duration. >",-
Earthen Tremor,Tempest,1,2,vs. Dodge,Short,blast (cone),"You send shockwaves through the earth, causing the ground to tremble violently. Target all creatures in the spell’s area. <strong>Weak. </strong>Deal +2 damage to each target. <strong>Strong. </strong>Deal +4 damage to each target and they are briefly staggered. <strong>Critical. </strong>Deal +6 damage to each target and they are briefly staggered.  > **Heightened**   <strong>(Rank 2)</strong> Choose one: - Deal +4/+8/+12 damage to each target instead. - Increase the spell‘s range to medium. <strong>(Rank 3) </strong>Choose one: - Deal +6/+12/+18 damage to each target instead. - Increase the spell‘s range to long.  >",-
Electrified Weapon,Tempest,1,2,Medium (8),Touch,"enchant (weapon),  singular","Imbue a weapon with the power of storms. If the target is dual-wielding, you can instead target both their held weapons. On a success, the weapon deals +2 lightning damage. On a strong or critical hit, the attack‘s target is briefly staggered. Each creature can suffer the condition from this spell only once per scene. If you target your own weapon, you can make a weapon attack with it as part of casting this spell. This spell lasts for a medium duration.   > **Heightened**   <strong>(Rank 2)</strong> The weapon deals +4 lightning damage instead. <strong>(Rank 3) </strong>The weapon deals +6 lightning damage instead. >",-
Lightning Javelin,Tempest,1,2,vs. Dodge,Medium,-,You conjure pure lightning in the form of a spear and hurl it against a creature. <strong>Weak.</strong><em> </em>Deal +4 lightning damage.  <strong>Strong.</strong> Deal +8 lightning damage and the target is briefly staggered. <strong>Critical.</strong> Deal +12 lightning damage and the target is briefly staggered.  > **Heightened**   <strong>(Rank 2)</strong> Deal +6/+12/+18 lightning damage instead. <strong>(Rank 3) </strong>Deal +8/+16/+24 lightning damage instead. >,-
Storm Coat,Tempest,1,2,Medium (8),Short,"enchant (body),  singular","You weave a protective coat of elemental energies around a creature. On a success, the creature gains the following effects: - You gain resistance against blast, frost, and lightning damage. - Whenever you are hit by a melee attack, the attacker takes +0 lightning damage (ignoring AV).   > **Heightened**   <strong>(Rank 2)</strong> The attacker takes +2 lightning damage (ignoring AV) instead. <strong>(Rank 3) </strong>The attacker takes +4 lightning damage (ignoring AV) instead. >",-
Storm Shield,Tempest,1,2,Medium (8),Self,quick,"You quickly conjure a personal barrier of swirling air. Cast this spell when you are attacked vs. your Parry or Dodge. On a success, you can defend with your Resist instead of Parry or Dodge until your next turn. When a melee attack against you fails, the attacker takes +0 blast damage (ignoring AV). If a ranged attack against you fails, you can divert the attack towards another creature in close range. If the ranged attack blunders, you can even divert it back to the attacker. When diverting an attack to another creature, it automatically hits with a weak success.   > **Heightened**   <strong>(Rank 2) </strong>Failed melee attacks inflict +2 blast damage (ignoring AV) instead. Diverted ranged attacks deal +2 damage. <strong>(Rank 3) </strong>Failed melee attacks inflict +4 blast damage (ignoring AV) instead. Diverted ranged attacks deal +4 damage. >",-
Volcanic Bolt,Tempest,1,2,vs. Dodge,Medium,-,You magically dissolve some earth or rock in your surroundings into lava. You can hurl the lava as a searing projectile against a creature. <strong>Weak.</strong><em> </em>Deal +4 fire damage.  <strong>Strong.</strong> Deal +8 fire damage and they suffer burning (2) for a short duration. <strong>Critical.</strong> Deal +12 fire damage and they suffer burning (4) for a short duration.  > **Heightened**   <strong>(Rank 2)</strong> Deal +6/+12/+18 fire damage instead and inflict burning (4/6) on a strong or critical success. <strong>(Rank 3) </strong>Deal +8/+16/+24 fire damage instead and inflict burning (6/8) on a strong or critical success. >,-
Wind Hose,Tempest,1,2,vs. Dodge,Medium,-,"You create a powerful swirl of air around the target location, pulling smaller, loose objects into it’s vortex. <strong>Weak.</strong><em> </em>Deal +3 damage. <strong>Strong.</strong> Deal +6 damage and if the target is medium or smaller in size, they are also grappled by the wind hose. <strong>Critical.</strong> Deal +9 damage and if the target is medium or smaller in size, they are also grappled and restrained by the wind hose. When you successfully cast this spell against a target and it is grappled by the wind hose, you gain +1 boon when casting the spell again against the same target on your next turn.   > **Heightened**   <strong>(Rank 2)</strong> Choose one: - Deal +5/+10/+15 damage instead. - You can also target large creatures for grappling. <strong>(Rank 3)</strong> Choose one: - Deal +7/+14/+21 damage instead. - You can also target huge creatures for grappling.  >",-
Conjure Elemental,Tempest,2,4,Hard (10),Long,concentrate,"You conjure a being of pure elemental power. Choose either air, earth, fire, or water. On a success, an elemental creature of the chosen element appears at any point within range. Treat the elemental as your companion (see Mounts &amp; Companions for more). It is friendly towards you and your allies while you maintain concentration for this spell. The elemental has the statistics of a tier 2 companion. In addition, it gains a companion trait, according to which element you have chosen. You can dismiss the elemental as a Quick Action during your turn. Otherwise it remains until reduced to 0 HP or for a short duration. If you lose concentration on this spell, the elemental becomes hostile to you and your allies. Roll initiative for it and treat it as an enemy. You can’t dismiss the elemental anymore and it remains until reduced to 0 HP or after the spell’s duration.   > **Heightened**   <strong>(Rank 3)</strong> You conjure an elemental with the statistics of a tier 3 companion instead. >",-
Lightning Bolt,Tempest,2,4,vs. Dodge,Medium,blast (line),"You summon a powerful bolt of lightning that streaks forth in a straight line from you to a target point, electrifying every creature it passes. <strong>Weak.</strong> Deal +4 lightning damage to each target. <strong>Strong.</strong> Deal +8 lightning damage to each target and they are briefly staggered. <strong>Critical.</strong> Deal +12 lightning damage to each target and they are briefly staggered.  > **Heightened**   <strong>(Rank 3)</strong> Choose one: - Deal +6/+12/+18 lightning damage to each target instead. - Increase the spell‘s range to long.  >",-
Lightning Step,Tempest,2,4,Hard (10),Medium,quick,"In a sudden flash of lightning you move at the speed of sound to another place. Cast this spell on your turn. Choose any point within range you can see, where you would be able to move to by walking, climbing, swimming, or jumping. On a success, you instantly move to the chosen location (this isn’t teleportation) without provoking Opportunity Attacks. When you arrive, you produce a loud booming sound, dealing +2 blast damage to all creatures in close range of you. Your Movement for the rest of the turn becomes 0.   > **Heightened**   <strong>(Rank 3)</strong> Increase the spell’s range to long and deal +4 blast damage instead. >",-
