name,tradition,rank,focus,target,range,properties,effect,heightened
Dazzling Light,Light,0,0,vs. Dodge,Medium,-,"You create a small point of light at the target location. The light provides dim light in short range of it. The light can also move with you while staying in range. When targeted at a creature, you can make the light violently explode instead. <strong>Weak.</strong> Deal +2 radiant damage. <strong>Strong. </strong>Deal +4 radiant damage. The target is also briefly blinded. <strong>Critical.</strong> Deal +6 radiant damage. The target is also briefly blinded and dazed.",-
Detect Lies,Light,0,0,vs. Resist,Close,quick,"You focus your senses on all creatures in range, gaining a glimpse into their immediate emotions. For any creature affected by this spell, you gain the following effects: - They suffer +1 bane on attacks against you. - The creature is never considered hidden from you, even if they are invisible. - You gain +1 boon on Insight rolls to determine their emotions, if they are lying, or concealing something. This spell lasts for a short duration or until an affected creature moves out of this spell’s range.",-
Illuminated Sight,Light,0,0,Medium (8),Self,enchant (eyes),"You concentrate light energy into your eyes, enhancing your eye sight and making you able to pierce through concealing environments. On a success, you gain the following effects: - You can see one range category further from sources of bright and dim light. - You gain +1 boon on Perception rolls. This spell lasts for a medium duration.",-
Revealing Burst,Light,0,0,vs. Resist,Short,-,"You let loose a quick burst of radiant energy in all directions, revealing any magical falsehoods, such as illusions, shapeshifters, or invisible creatures in range. For illusions, compare your result vs. the Resist of the illusion’s creator to see if they are broken. <strong>Weak.</strong> Any magical falsehood is marked by a shimmer of light. Rolls that target any marked target gain +1 boon. The mark lasts for a short duration. <strong>Strong.</strong> Any magical falsehood is immediately broken. <strong>Critical.</strong> Any magical falsehood is immediately broken and any creature revealed by this is briefly shaken.",-
Blessing of Light,Light,1,2,Medium (8),Touch,"enchant (eyes),  singular","You bless a creature with the magical power of light, making them enlightened to their surroundings. On a success, the creature gains the following effects: - You can see one range category further from sources of bright and dim light. - You gain +1 boon on Perception rolls. This spell lasts for a long duration.   > **Heightened**   <strong>(Rank 2)</strong> The target gains resistance to fire and radiant damage for the spell‘s duration. <strong>(Rank 3)</strong> The target gains resistance to fire, necrotic, psychic, and radiant damage for the spell‘s duration. >",-
Locate Trinket,Light,1,2,Medium (8),Touch,singular,"Touch a small object and imbue it with truth revealing magic. The object must comfortably fit within the palm of your hand and can be no larger. On a success, you always know the location of the imbued trinket while it is in the same sphere of existence as you. This spell lasts for a long duration.",-
Protect from Influence,Light,1,2,Medium (8),Medium,"quick,  singular","Channel the light’s protective magic into one creature within range, bolstering their mental defenses. Cast this spell as a Quick Action on your turn. On a success, the target gains +1 boon on rolls to resist any mental effects and gains resistance to psychic damage. Attempts to influence their mind also suffer +1 bane. This spell lasts for a short duration.",-
Radiant Burst,Light,1,2,vs. Dodge,Medium,-,"You let forth a burst of radiant energy, streaking towards a target location and exploding in burning light. <strong>Weak.</strong> Deal +2 radiant damage to any creature in melee range of the target location. <strong>Strong. </strong>Deal +4 radiant damage to any creature in melee range of the target location. Each target is also briefly blinded. <strong>Critical.</strong> Deal +6 radiant damage to any creature in melee range of the target location. Each target is also briefly blinded. Each target is also briefly blinded and dazed.",-
Radiant Weapon,Light,1,2,Medium (8),Touch,"enchant (weapon),  singular","Imbue a weapon with the power of the sun. If the target is dual-wielding, you can instead target both their held weapons. On a success, the weapon emits bright light in melee range and dim light in close range of it and deals +2 radiant damage. If you target your own weapon, you can make a weapon attack with it as part of casting this spell. This spell lasts for a medium duration.   > **Heightened**   <strong>(Rank 2)</strong> The weapon emits bright light in close range and dim light in short range and deals +4 radiant damage instead. <strong>(Rank 3) </strong>The weapon emits bright light in short range and dim light in medium range and deals +6 radiant damage instead. >",-
Sun Sphere,Light,1,2,Medium (8),Medium,concentrate,"You conjure a small orb of flame resembling a miniature sun. On a success, the sphere appears at the target location. It also shines bright light in close range and dim light in short range of it.  Any creature in melee range of it takes +4 fire damage when they first come into contact with it and at the start of each of their turns. On each of your following turns, you can use your Quick Action to move the beam a close distance within range. The sphere lasts for a short duration.",-
True Strike,Light,1,2,vs. Resist,Short,quick,"You focus on a creatures thoughts, gaining insight into their defenses. Cast this spell on your turn. On a success, increase the SL of your next attack until the end of your next turn by one step (max. critical success).",-
Break Curse,Light,2,4,Hard (10),Touch,ritual (minutes),"You initiate a purifying ritual to remove harmful influences from a creature’s soul. On a success, you break one curse the creature is afflicted with. Any single creature can only benefit from this spell once per day.",-
Destroy Undeath,Light,2,4,vs. Resist,Short,-,"You channel the power of divine light, flooding undead creatures around you with it in an attempt to annihilate them instantly. <strong>Weak.</strong> Any undead creature in range of tier 0 or 1 is instantly destroyed and can’t reanimate. <strong>Strong.</strong> Any undead creature in range of tier 0 or 1 is instantly destroyed and can’t reanimate. Any other undead creature in range is also briefly frightened of you, ignoring any immunity they might have against the condition. <strong>Critical.</strong> Any undead creature in range of tier 0 or 1 is instantly destroyed and can’t reanimate. Any other undead creature in range is also frightened of you for a short duration, ignoring any immunity they might have against the condition. They can roll Spirit + Fortitude vs. your Resist at the end of their turns to end the effect early.",-
Sunbeam,Light,2,4,Hard (10),Medium,concentrate,"You call down a pillar of light at the target location, revealing any falsehoods and burning creatures within it. On a success, the beam extends in melee range of the target location and a medium distance in height. It also shines bright light in close range and dim light in short range of it. Any magical falsehoods, such as illusions, shapeshifters, or invisible creatures inside the beam is immediately revealed. Any creatures inside the beam take +8 radiant damage when they first come into contact with it and at the start of each of their turns. On each of your following turns, you can use your Quick Action to move the beam a short distance within range. The beam lasts for a short duration.",-
Purifying Light,Light,3,6,Very Hard (12),Long,-,"You create an explosion of pure, cleansing light that burns away darkness and evil influences. Choose a close area within range. All creatures within the area are affected. <strong>Weak.</strong> Deal +6 radiant damage to hostile creatures, restore +3 HP to allies, and remove one negative condition from all allies. <strong>Strong.</strong> Deal +12 radiant damage to hostile creatures, restore +6 HP to allies, and remove up to two negative conditions from all allies. <strong>Critical.</strong> Deal +18 radiant damage to hostile creatures, restore +9 HP to allies, and remove up to three negative conditions from all allies. Any areas of magical darkness within range are permanently dispelled.",-
Solar Flare,Light,3,6,vs. Dodge,Long,blast (cone),You unleash a devastating cone of solar energy that burns and blinds everything in its path. <strong>Weak.</strong> Deal +6 radiant damage to each target and they are briefly blinded. <strong>Strong.</strong> Deal +12 radiant damage to each target and they are blinded for a short duration. <strong>Critical.</strong> Deal +18 radiant damage to each target and they are blinded for a short duration and briefly stunned. Any creatures with light sensitivity or that are undead take an additional +6 radiant damage from this spell.,-
Blessing of Dawn,Light,3,6,Very Hard (12),Short,"enchant (body), singular","You invoke the power of the rising sun, blessing an ally with dawn's radiance and renewal. On a success, the target gains the following effects for a long duration: - They regain +2 HP at the start of each of their turns - They gain immunity to fear and charm effects - They can see through magical darkness and illusions - Once per day, they can reroll any failed saving throw - They emit bright light in close range and dim light in short range",-
Dark Sight,Twilight,0,0,Medium (8),Self,enchant (eyes),"You magically adjust your senses to adapt to total darkness, allowing you to see without any source of light. On a success, you can see a medium distance in absolute darkness as in dim light. If you are exposed to bright light while under the effects of these spells, roll Spirit + Fortitude. On a failure, this spell ends and you are briefly dazed. Otherwise, this spell lasts for a medium duration.",-
Night’s Grasp,Twilight,0,0,vs. Dodge,Medium,-,"You magically animate the shadows around a creature, clawing and grasping for the target with ghostly coldness. <strong>Weak. </strong>The target suffers +2 frost damage. <strong>Strong.</strong> The target suffers +4 frost damage and is briefly slowed. <strong>Critical.</strong> The target suffers +6 frost damage and is briefly grappled by the shadows. You can also cast this spell to cool down an object, such as extinguishing the last embers of a campfire.",-
Shadow Veil,Twilight,0,0,Medium (8),Medium,-,"You create an area of magical shadow, making it hard to see through it. Target any area of dim light in range. On a success, the magical shadow appears in a close radius around the target area. The area is now considered as absolute darkness. The shadow lasts a short duration or is broken early if any source of bright light enters the shadow’s area.   ### Mirror of Shadows **Rank** | **Focus** | **Target** | **Range** | **Properties** ---|---|---|---|---  0 | 0 | Medium (8) | Self | enchant (face) **Effect**   You weave shadows around your face to create a false appearance, blending deception with twilight magic. On a success, your facial features become obscured and shift subtly, making you difficult to identify. You gain +1 boon on rolls to disguise yourself or avoid recognition. Whenever anyone attempts to remember specific details about your appearance, they must first succeed on a Spirit + Perception roll vs. your Resist. On a failure, they can only recall vague, conflicting details. This spell lasts for a medium duration or until you choose to end it.",-
Whispers of Doubt,Twilight,0,0,vs. Resist,Medium,-,"You summon ghostly whispers into the mind of the target, seeding doubt and confusing them. <strong>Weak. </strong>The target suffers +0 psychic damage (ignoring AV). <strong>Strong.</strong> The target suffers +2 psychic damage (ignoring AV) and the target is briefly confused. <strong>Critical.</strong> The target suffers +4 psychic damage (ignoring AV) and the target is confused for a short time. They can roll Spirit + Fortitude vs. your Resist at the end of their turns to end the effect early.",-
Cloak of Night,Twilight,1,2,Medium (8),Medium,singular,"You clad a creature in a magical cloak made of darkness. On a success, the creature wearing the cloak gains the following effects: - You have resistance against frost damage. - You gain +1 boon on Agility + Stealth rolls to hide or move silently. The cloak lasts for a medium duration or until discarded by the creature.",-
Curse of Twilight,Twilight,1,2,vs. Resist,Short,singular,"You curse a creature with the magical power of twilight, bringing the fear of night into their heart. On a success, the creature suffers the following effects: - They see in bright light as in dim light. - They suffer +1 bane on Perception and Initiative rolls. This curse lasts for a long duration.   > **Heightened**   <strong>(Rank 2)</strong> The target suffers a weakness to either frost or psychic damage (choose one) for the spell‘s duration. <strong>(Rank 3)</strong> The target suffers a weakness to both frost and psychic damage for the spell‘s duration. >",-
Lunar Weapon,Twilight,1,2,Medium (8),Touch,"enchant (weapon),  singular","Imbue a weapon with the power of the night. If the target is dual-wielding, you can instead target both their held weapons. On a success, the weapon emits dim light in close range of it and deals +2 frost damage. On a strong or critical hit, the attack‘s target is briefly slowed. Each creature can suffer the condition from this spell only once per scene. If you target your own weapon, you can make a weapon attack with it as part of casting this spell. This spell lasts for a medium duration.   > **Heightened**   <strong>(Rank 2)</strong> The weapon deals +4 frost damage instead. <strong>(Rank 3) </strong>The weapon deals +6 frost damage instead. >",-
Moon Sphere,Twilight,1,2,Medium (8),Medium,concentrate,"You conjure a small orb of freezing coldness resembling a miniature moon. On a success, the sphere appears at the target location. It also shines dim light in short range of it. Any creature in melee range of it takes +4 frost damage when they first come into contact with it and at the start of each of their turns. On each of your following turns, you can use your Quick Action to move the beam a close distance within range. The sphere lasts for a short duration.",-
Shadow Meld,Twilight,1,2,Medium (8),Self,concentrate,"You submerge into the shadows around you. Cast this spell while standing in dim light or darkness. On a success, you merge with the shadows and become invisible. While invisible, you are hidden from any creature which hasn‘t an ability to see through invisibility. This spell lasts for a short duration, until you attack or cast another spell, or until you enter bright light.",-
Whisper of Dreams,Twilight,1,2,vs. Resist,Short,-,"You lull a creature’s mind with whispers of sleep. The target has to be of a tier equal to or lower than your Mysticism. If the creature is at full HP, you suffer +1 bane on the roll. On a success, the creature falls unconscious for a medium duration. If any creature uses an Action to shake them, they take any damage, or are otherwise disturbed, they wake up.",-
Aura of Fear,Twilight,1,2,Hard (10),Self,concentrate,"You emanate an aura of primal terror that affects all hostile creatures in close range. On a success, you create an aura that moves with you for a short duration. Any hostile creature that starts their turn within close range of you must roll Spirit + Mysticism vs. your Resist. On a failure, they become frightened of you until the start of their next turn and take +1 psychic damage (ignoring AV). A creature can only be affected by this saving throw once per turn. Creatures that succeed on their saving throw are immune to this spell's fear effect until the spell ends.",-
Haunting Shadows,Twilight,1,2,vs. Resist,Medium,concentrate,"You conjure vengeful shadows that follow and torment a target with chilling whispers and ghostly touches. On a success, spectral shadows begin haunting the target. The target takes +3 psychic damage at the start of each of their turns, followed by +2 frost damage. The shadows whisper disturbing thoughts, causing the target to suffer +1 bane on concentration rolls. The haunting lasts for a short duration. The target can roll Spirit + Fortitude vs. your Resist at the end of their turns to end the effect early.",-
Twilight Bind,Twilight,1,2,vs. Resist,Medium,concentrate,"You weave twilight magic into a creature's mind, temporarily turning them from foe to friend through shadow manipulation. The target must be of a tier equal to or lower than your Mysticism. On a success, the target becomes charmed by you and treats you and your allies as friends for a short duration. The charmed creature takes +2 psychic damage at the start of each of their turns as the foreign magic conflicts with their will. The creature can roll Spirit + Fortitude vs. your Resist at the end of their turns to end the effect early. If the creature takes damage from you or your allies, they can immediately make this saving throw with +1 boon.",-
Everlasting Night,Twilight,2,4,Hard (10),Medium,concentrate,"You cloud an area in absolute darkness and no light may pierce through it. On a success, the close area around the target location becomes absolute darkness. Any light source within it immediately goes out. This spell lasts for a medium duration.",-
Moonbeam,Twilight,2,4,Hard (10),Medium,concentrate,"You call down a beam of moonlight at the target location, blinding and freezing anything within it. On a success, the beam extends in melee range of the target location and a medium distance in height. It also shines dim light in close range of it. Any creatures inside the beam are blinded and take +8 frost damage when they first come into contact with it and at the start of each of their turns. On each of your following turns, you can use your Quick Action to move the beam a short distance within range. The beam lasts for a short duration.",-
Shadow Step,Twilight,2,4,Hard (10),Medium,-,"You fully submerge into the shadows and re-appear at another darkened location. While standing in dim light or darkness, choose any other location you can see in range that is also in dim light or darkness. On a success, you teleport to the chosen location.",-
Silent Night,Twilight,2,4,Hard (10),Medium,-,"You create a zone of absolute silence, muffling all sound within it. Choose a close area within range. On a success, the area becomes completely silent. No sound can be made within the area or pass through it. Creatures within the area cannot speak, cast spells with verbal components, or make noise. Any creatures attempting to hide within the area gain +2 boons on Stealth rolls as they cannot be detected by sound. The silence lasts for a medium duration.",-
Terrors of the Dark,Twilight,2,4,vs. Resist,Medium,-,"You fill an area with frightening shadows that take the shape of each creature's worst fears. Choose a close area within range that contains dim light or darkness. Target all hostile creatures within the area. <strong>Weak.</strong> Each target is briefly frightened and takes +2 psychic damage (ignoring AV). <strong>Strong.</strong> Each target is frightened for a short duration and takes +4 psychic damage (ignoring AV). They can roll Spirit + Fortitude vs. your Resist at the end of their turns to end the fear early. <strong>Critical.</strong> Each target is frightened for a short duration and briefly stunned, taking +6 psychic damage (ignoring AV). They can roll Spirit + Fortitude vs. your Resist at the end of their turns to end the fear early.",-
Shadow Clone,Twilight,3,6,Very Hard (12),Medium,concentrate,"You shape shadows into a perfect duplicate of yourself that can act independently in darkened areas. On a success, you create a shadow clone in any area of dim light or darkness within range. The clone has your appearance but is made of living shadow. It has 1 HP, your movement speed, and can perform simple tasks and basic attacks using your statistics. The clone can only exist in dim light or darkness - if it enters bright light, it is immediately destroyed. The clone lasts for a medium duration, until destroyed, or until you dismiss it. You can command the clone telepathically and see through its senses as a Quick Action.   > **Heightened**   You can switch places with your shadow clone as a Quick Action, teleporting to its location while it appears where you were standing. >",-
Embrace of Night,Twilight,3,6,Very Hard (12),Self,"concentrate, enchant (body)","You merge temporarily with the essence of twilight, gaining supernatural abilities in the balance between light and dark. On a success, you gain the following effects: - You become invisible while in dim light or darkness - You gain resistance to psychic and frost damage - You can pass through solid objects as if they were difficult terrain while invisible - Your twilight mysticism spells cost 1 less Focus (minimum 0) This transformation lasts for a short duration.",-
Nightmare Realm,Twilight,3,6,vs. Resist,Short,concentrate,"You trap targets in a twilight realm of their own fears and doubts, dealing ongoing psychic and frost damage. Choose a close area within range. Target all hostile creatures within the area. <strong>Weak.</strong> Each target takes +4 psychic damage and +2 frost damage, then is briefly frightened. <strong>Strong.</strong> Each target takes +8 psychic damage and +4 frost damage, then is frightened for a short duration. They can roll Spirit + Fortitude vs. your Resist at the end of their turns to end the fear early. <strong>Critical.</strong> Each target takes +12 psychic damage and +6 frost damage, then is frightened and briefly stunned. They can roll Spirit + Fortitude vs. your Resist at the end of their turns to end the fear early. The realm persists for a short duration, and any creature that starts their turn in the area takes +2 psychic damage.",-
Life Shield,Life,0,0,Medium (8),Medium,singular,"On a success, the target is surrounded by a near invisible shield of life force. The shield grants 5 temporary HP and lasts until reduced to 0, or expires after a short duration. Any single creature can only benefit from this spell once per scene.",-
Restore Life,Life,0,0,Special,Short,-,"You let vitalizing energy flow into your target, restoring a living creatures health or harming an undead creature. When targeting a living creature, roll vs. moderate difficulty (8). When targeting an undead creature, roll vs. their Resist. <strong>Weak.</strong> Restore +2 HP to your target or deal +3 radiant damage against an undead target. <strong>Strong.</strong> Restore +4 HP to your target or deal +6 radiant damage against an undead target. <strong>Critical. </strong>Restore +6 HP to your target or deal +9 radiant damage against an undead target.",-
Verdant Blast,Life,0,0,vs. Dodge,Medium,-,"You form a condensed mass of positive energy, blasting the enemy and healing nearby allies. <strong>Weak.</strong> Deal +2 radiant damage. <strong>Strong.</strong> Deal +4 radiant damage and restore 2 HP to allies in melee range of the target. <strong>Critical.</strong> Deal +6 radiant damage and restore 4 HP to allies in melee range of the target.",-
Blessing of Life,Life,1,2,Medium (8),Touch,singular,"You bless a creature with the magical power of life, bolstering their vitality. On a success, the creature gains the following effects: - You gain 5 temporary HP. They replenish after a short break. - You gain +1 boon on Fortitude rolls. This spell lasts for a long duration.   > **Heightened**   <strong>(Rank 2)</strong> You gain 10 temporary HP instead. <strong>(Rank 3)</strong> You gain 20 temporary HP instead. >",-
Healing Touch,Life,1,2,Medium (8),Touch,-,"You focus life-giving magic into an injury, mending it quickly or taking longer to close more grievous injuries. You can cast this spell using an Action or casting it as a ritual (minutes).  <strong>Action.</strong> Restore +4/8/12 HP to your target. <strong>Ritual (minutes). </strong>On a success, you heal one Wound from a creature. Any single creature can only benefit from the effect of this spell once per day.  > **Heightened**   <strong>(Rank 2)</strong> When using your Action, restore +6/12/16 HP instead. When casting this spell as a ritual (minutes) instead, heal up to two Wounds from a creature. <strong>(Rank 3)</strong> When using your Action, restore +8/16/24 HP instead. When casting this spell as a ritual (minutes) instead, heal up to three Wounds from a creature. >",-
Overflow of Life,Life,1,2,Medium (8),Medium,-,"You overwork the vital system of the target, returning them to consciousness or causing them a heart attack if already conscious. The target must be a living creature. <strong>Weak.</strong> If the target is dying, they stop dying but remain unconscious. If the target is unconscious, they wake up. If the target is conscious, they take +3 radiant damage. <strong>Strong.</strong> If the target is dying, they stop dying and wake up. If the target is unconscious, they wake up. If the target is conscious, they take +6 radiant damage. <strong>Critical.</strong> If the target is dying, they stop dying, wake up, and one of their Injuries is instantly treated (their choice). If the target is unconscious, they wake up. If the target is conscious, they take +9 radiant damage.  > **Heightened**   <strong>(Rank 2)</strong> If the target is conscious, they take +5/10/15 radiant damage instead. <strong>(Rank 3)</strong> If the target is conscious, they take +7/14/21 radiant damage instead. >",-
