name,tradition,rank,focus,target,range,properties,effect,heightened
Rapid Vitality,Life,1,2,Medium (8),Medium,quick,You quickly envigorate a creature. Cast this spell on your turn. <strong>Weak.</strong> Restore +2 HP to your target. <strong>Strong.</strong> Restore +4 HP to your target. <strong>Critical. </strong>Restore +6 HP to your target.  > **Heightened**   <strong>(Rank 2)</strong> Restore +4/8/12 HP instead. <strong>(Rank 3)</strong> Restore +6/12/18 HP instead. >,-
Vitalizing Weapon,Life,1,2,Medium (8),Touch,"enchant (weapon),  singular","Imbue a weapon with the power of vitality. If the target is dual-wielding, you can instead target both their held weapons. On a success, any strong or critical hit with the weapon restores 4 HP to the wielder. If you target your own weapon, you can make a weapon attack with it as part of casting this spell. This spell lasts for a medium duration.   > **Heightened**   <strong>(Rank 2)</strong> On a strong or critical hit, restore 6 HP instead. <strong>(Rank 3)</strong> On a strong or critical hit, restore 8 HP instead. >",-
Aid,Life,2,4,Hard (10),Short,enchant (body),"Bolster your allies’ toughness with a blessing. On a success, choose up to four creatures in range. They each gain 10 temporary HP for a long duration.   > **Heightened**   <strong>(Rank 3)</strong> Each target gains 20 temporary HP instead. >",-
Cleanse,Life,2,4,Hard (10),Medium,"quick,  singular","Relieve a creature from any negative conditions. Cast this spell on your turn. Target a willing creature. On a success, remove the following conditions from the target: bleeding, burning, blinded, charmed, confused, dazed, deafened, frightened, paralyzed, poisoned, silenced, slowed, staggered, and stunned. This doesn’t remove conditions applied by a continuous effect that affects the target indirectly, such as an persistent area effect.  > **Heightened**   <strong>(Rank 3)</strong> Choose an additional willing target in range. >",-
Hallow Ground,Life,2,4,Hard (10),Close,concentrate,"You hallow the ground around you, healing all allies standing on it. On a success, each ally in range of the hallow ground restores +2 HP when you cast the spell and at the start of each of their turns. The hallow ground remains stationary at the position where you cast it for a short duration.   > **Heightened**   <strong>(Rank 3)</strong> Restore +4 HP instead. >",-
Healing Burst,Life,2,4,Hard (10),Short,blast (cone),"You conjure a wave of healing energy, restoring the endurance of all allies within it. <strong>Weak.</strong> Restore +3 HP to each ally. <strong>Strong.</strong> Restore +6 HP to each ally. <strong>Critical. </strong>Restore +9 HP to each ally.  > **Heightened**   <strong>(Rank 3)</strong> Restore +5/10/15 HP instead. >",-
Abundance of Life,Life,3,6,Very Hard (12),Long,concentrate,"You create a powerful zone of life energy that continuously restores vitality to your allies. On a success, you create the zone in short range of the target location. While the spell is active, apply the following effects: - Allies within the zone restores +4 HP when you cast the spell and at the start of each of their turns. - When an ally within the zone is affected by any healing effect other than from this spell, increase that healing by 4 HP. - Any ally within the zone suffering one or more Wounds can use their Action to bathe in the zone’s life force and instantly heal one of their Wounds and regain +8 HP. Any single creature can only benefit from this effect of this spell once per day. The zone lasts for a medium duration.",-
Vitality Surge,Life,3,6,vs. Dodge,Medium,blast (cone),You unleash a devastating explosion of pure life force that overwhelms your enemies' vital systems while gently reinvigorating your allies. Target all hostile creatures and your allies within the spell’s area. Compare the roll against a very hard Difficulty (12) to calculate the SL for your allies. <strong>Weak.</strong> Deal +6 radiant damage to each hostile target. Restore +3 HP to each ally. <strong>Strong.</strong> Deal +12 radiant damage to each hostile target and they are briefly dazed. Restore +6 HP to each ally. <strong>Critical.</strong> Deal +18 radiant damage to each hostile target and they are briefly stunned. Restore +9 HP to each ally.,-
Chill Touch,Death,0,0,vs. Parry,Melee,-,"Your touch carries the cold of the grave, sapping warmth and vitality from your target. <strong>Weak.</strong> Deal +2 frost damage and the target cannot regain HP until the end of your next turn. <strong>Strong.</strong> Deal +4 frost damage and the target cannot regain HP until the end of your next turn. <strong>Critical.</strong> Deal +6 frost damage and the target cannot regain HP until the end of your next turn.",-
Decay,Death,0,0,Medium (8),Short,-,"You accelerate the natural decay of organic matter, causing wood to rot, food to spoil, and cloth to fray. On a success, you can rapidly age and decay non-living organic materials (such as wooden objects, food, or clothing) within range. This spell affects objects up to medium size and can be used to: - Spoil food or drink, making it inedible - Weaken wooden doors, weapons, or structures (reducing their durability) - Age clothing or leather to the point of tearing This spell lasts briefly, but its effects are permanent on the targeted materials.",-
Enfeebling Touch,Death,0,0,vs. Resist,Medium,-,"You summon a swirl of negative energy, engulfing the target and draining their strength. <strong>Weak. </strong>Deal +2 necrotic damage. <strong>Strong. </strong>Deal +4 necrotic damage and briefly reduce their Strength die by one step. <strong>Critical. </strong>Deal +6 necrotic damage and reduce their Strength die by one step for a short duration. They can roll Spirit + Fortitude vs. your Resist at the end of their turns to end the effect early.",-
Glimpse of Mortality,Death,0,0,vs. Resist,Medium,-,"You project a scene of the target‘s final moments before death into their mind, in which they die in agony at the hands of yourself and your allies. <strong>Weak. </strong>The target suffers +0 psychic damage (ignoring AV). <strong>Strong.</strong> The target suffers +2 psychic damage (ignoring AV) and the target is briefly frightened. <strong>Critical.</strong> The target suffers +4 psychic damage (ignoring AV) and the target is frightened for a short time. They can roll Spirit + Fortitude vs. your Resist at the end of their turns to end the effect early.",-
Spared from Death,Death,0,0,Medium (8),Short,-,"You help a dying creature in range to cling onto life. <strong>Weak.</strong> +1 to the dice result of the dying creature. <strong>Strong.</strong> +2 to the dice result of the dying creature. <strong>Critical.</strong> You stop the creature from dying, but they remain unconscious.",-
Blood Shards,Death,1,2,vs. Dodge,Medium,-,"You conjure razor-sharp crystallized blood shards and hurl them at your target, piercing their flesh and drawing life force back to you. <strong>Weak.</strong> Deal +4 necrotic damage and regain 2 HP. <strong>Strong.</strong> Deal +8 necrotic damage and regain 4 HP. <strong>Critical.</strong> Deal +12 necrotic damage and regain 6 HP.",-
Curse of Death,Death,1,2,vs. Resist,Short,singular,"You curse a creature with the magical power of death, withering their mortal body. On a success, the creature suffers the following effects: - Their max. HP are reduced by 5. - They can't regain HP.  - They suffer +1 bane on Fortitude rolls. This curse lasts for a long duration.   > **Heightened**   <strong>(Rank 2)</strong> The target suffers a weakness to either necrotic or poison damage (choose one) for the spell‘s duration. <strong>(Rank 3)</strong> The target suffers a weakness to both necrotic and poison damage for the spell‘s duration. >",-
Early Grave,Death,1,2,vs. Parry,Medium,-,"Skeletal hands sprout from the ground, scratching at the target and attempting to pull them below the earth. <strong>Weak.</strong> Deal +3 necrotic damage. <strong>Strong.</strong> Deal +6 necrotic damage and the target is grappled by the hands. <strong>Critical.</strong> Deal +9 necrotic damage and the target is grappled and briefly restrained by the hands.",-
Necrotic Weapon,Death,1,2,Medium (8),Touch,"enchant (weapon),  singular","Imbue a weapon with the power of death. If the target is dual-wielding, you can instead target both their held weapons. On a success, the weapon deals +2 necrotic damage. On a strong or critical hit, the attack’s target also suffers 2 lasting necrotic damage for a short duration. Each creature can suffer the condition from this spell only once per scene. If you target your own weapon, you can make a weapon attack with it as part of casting this spell. This spell lasts for a medium duration.   > **Heightened**   <strong>(Rank 2)</strong> The weapon deals +4 necrotic damage instead. On a strong or critical hit, inflict 4 lasting necrotic damage instead. <strong>(Rank 3) </strong>The weapon deals +6 necrotic damage instead. On a strong or critical hit, inflict 6 lasting necrotic damage instead. >",-
Rotting Grasp,Death,1,2,vs. Parry,Melee,-,"Your touch carries the power of decay, causing flesh to wither and rot where you grasp your target. <strong>Weak.</strong> Deal +3 necrotic damage and the target suffers +1 bane on their next attack roll. <strong>Strong.</strong> Deal +6 necrotic damage and the target is briefly sickened (reducing all their attributes by one die step). <strong>Critical.</strong> Deal +9 necrotic damage and the target is sickened for a short duration (reducing all their attributes by one die step). They can roll Strength + Fortitude vs. your Resist at the end of their turns to end the effect early.",-
Shivering Ray,Death,1,2,vs. Dodge,Medium,-,"You shoot a icy blue beam from the tip of your finger, rigidifying the target. <strong>Weak.</strong> You deal +3 frost damage.  <strong>Strong.</strong> You deal +6 frost damage and the target is briefly slowed. <strong>Critical.</strong> You deal +9 frost damage and the target is briefly dazed and slowed.",-
Cloud of Sickness,Death,2,4,vs. Resist,Medium,-,"You summon a cloud of necrotic energy, sickening creatures within it. The cloud extends in a close area around the target location and targets all living creatures within it. <strong>Weak.</strong> Deal +3 necrotic damage to each target. <strong>Strong.</strong> Deal +6 necrotic damage to each target. <strong>Critical.</strong> Deal +9 necrotic damage to each target. Any creature is also poisoned while inside the cloud’s area. The cloud lasts for a short duration. It can also be expelled early by any effect causing strong winds in the same area of influence.",-
Circle of Death,Death,2,4,Hard (10),Medium,concentrate,"You draw a mystical circle filled with symbols of mortality, creating a zone where life force withers. On a success, you create the circle in close range of the target location. While the circle remains, any living creature that starts their turn within it takes +4 necrotic damage and suffers +1 bane on healing effects. Undead creatures in the circle instead regain +2 HP at the start of their turns. The circle lasts for a short duration.",-
Wither,Death,2,4,vs. Resist,Short,concentrate,"You channel entropic energy into a creature, causing their body to age and decay rapidly. On a success, the target suffers the following effects: - They take +2 necrotic damage at the start of each of their turns. - Their maximum HP is reduced by 2 at the start of each of their turns. - They suffer +1 bane on all physical attribute rolls (Strength and Agility). This spell lasts for a short duration. Any HP reduction from this spell is restored when the spell ends.",-
Mortal Coil,Death,3,6,vs. Resist,Medium,-,"You bind a creature's life force to your own, creating a connection that shares their suffering while draining their vitality. <strong>Weak.</strong> Deal +6 necrotic damage and regain half that amount as HP. The target's next successful attack against you deals half damage. <strong>Strong.</strong> Deal +12 necrotic damage and regain half that amount as HP. The target's next two successful attacks against you deal half damage. <strong>Critical.</strong> Deal +18 necrotic damage and regain half that amount as HP. For a short duration, any damage the target takes is also reflected to them as 2 additional necrotic damage.",-
Death's Door,Death,3,6,vs. Resist,Medium,-,"You show the target a vision of their own death, paralyzing them with the certainty of mortality. The target must be of a tier equal to or lower than your Mysticism. <strong>Weak.</strong> The target is briefly stunned and takes +4 psychic damage (ignoring AV). <strong>Strong.</strong> The target is stunned for a short duration and takes +8 psychic damage (ignoring AV). They can roll Spirit + Fortitude vs. your Resist at the end of their turns to end the stun early. <strong>Critical.</strong> The target is paralyzed for a short duration and takes +12 psychic damage (ignoring AV). They can roll Spirit + Fortitude vs. your Resist at the end of their turns to end the paralysis early.",-
Poison Bloom,Death,3,6,vs. Resist,Short,-,"You channel the essence of natural toxins into an area, creating a field where death's poisons flourish. Choose a close area within range. Target all living creatures within the area. <strong>Weak.</strong> Each target takes +4 poison damage and is briefly poisoned. <strong>Strong.</strong> Each target takes +8 poison damage and is poisoned for a short duration. They can roll Strength + Fortitude vs. your Resist at the end of their turns to end the poisoned condition early. <strong>Critical.</strong> Each target takes +12 poison damage and is poisoned for a short duration. Additionally, they suffer +2 poison damage at the start of each of their turns while poisoned. They can roll Strength + Fortitude vs. your Resist at the end of their turns to end the condition early.",-
Acid Splash,Nature,0,0,vs. Dodge,Medium,-,"You conjure a short spray of acid, burning through the target’s surface. <strong>Weak.</strong> Deal +2 acid damage (ignoring 1/2 AV). <strong>Strong.</strong> Deal +4 acid damage (ignoring 1/2 AV). <strong>Critical.</strong> Deal +6 acid damage (ignoring 1/2 AV).",-
Bestial Adaptation,Nature,0,0,Medium (8),Self,"concentrate,  enchant (body),  quick","You adopt the physical characteristics of one chosen type of animal. Cast this spell as a Quick Action on your turn. Choose one of the following: - Graceful (You can move through difficult terrain without penalty) - Perceptive (+1 boon on Perception rolls) - Strong (+1 boon on Strength + Athletics rolls, +2 damage on unarmed attacks) - Tough (+2 AV (armor bonus)) On a success, you gain the chosen effect. If you cast this spell multiple times, you only retain the newest option chosen. This spell lasts for a short duration.",-
Lashing Vine,Nature,0,0,Special,Medium,-,"You animate a natural vine or let one spring from the ground in range. The vine can either lash at (vs. Parry) or grab (vs. Parry or Dodge) any target close to it. The vine counts as a medium creature for grappling. <strong>Weak. </strong>Deal +2 damage (lash) or grapple the target (grab). <strong>Strong.</strong> Deal +4 damage (lash) or deal +0 damage and grapple the target (grab). <strong>Critical. </strong>Deal +6 damage (lash) or deal +2 damage, grapple, and briefly restrain the target (grab). if you continue to cast this spell over multiple turns, the vine can remain for the duration. Otherwise the vine quickly withers and vanishes after using this spell. You can also use the vine to grab, pull, or throw smaller objects.",-
Poison Mist,Nature,0,0,vs. Dodge,Short,-,Spray a cloud of poisonous mist against your target. <strong>Weak.</strong> Deal +2 poison damage. <strong>Strong.</strong> Deal +4 poison damage and the target is briefly poisoned. <strong>Critical.</strong> Deal +6 poison damage and the target is poisoned for a short duration. They can roll Strength + Fortitude vs. your Resist at the end of their turns to end the effect early.,-
Rejuvenation,Nature,0,0,Medium (8),Short,singular,"Conjure magical energy into one creature in range, rapidly increasing their natural regenerative capacity. <strong>Weak. </strong>The target shortly regains +0 HP at the start of each of their turns. <strong>Strong. </strong>The target shortly regains +2 HP at the start of each of their turns. <strong>Critical. </strong>The target shortly regains +4 HP at the start of each of their turns.",-
Shillelagh,Nature,0,0,Special,Self,-,"You imbue a wooden weapon with nature’s power to strike your enemy with. Choose any crush weapon you are holding that is made from wood. Roll an attack with that weapon using Spirit + Mysticism. On a hit, also use your spell power instead of the attribute you would use for the weapon (Strength/Agility).",-
Beast Form,Nature,1,2,Medium (8),Self,enchant (body),"You shape shift into the form of a land-based animal. You can change into any animal form you encountered before. For this, reference the Tier 1 or lower Companion Statistics and pick any valid Animal Trait from the Animal Companions section. Apply the given statistics in the following way: - Pick any Size valid for the beast form’s Tier. - You gain half of the HP your beast form would have as an Animal Companion as temporary HP (you keep your own current and max. HP). - Apply the beast form’s AV bonus as an armor bonus. - Replace your Strength and Agility with that of your beast form if they are higher. Your Spirit and Mind aren’t changed. - You keep your own skill ranks and don’t use those of the beast form. - Apply the beast form’s weapon damage to any attacks made with natural weapons. If you have any bonuses to the damage of these attacks, you can apply them normally. - You gain the amount of base Movement per turn of your beast form, unless your normal Movement is higher. - You can use any abilities your beast form’s animal traits provide.  You can’t cast spells while in beast form, except for re-casting this spell to extend it‘s duration without interruption. You can still speak and understand any languages you would normally while in your beast form. Your beast form lasts for a medium duration, until you end it willingly, or until you fall unconscious.   > **Heightened**   <strong>(Rank 2)</strong> You can choose from the Companion Statistics up to Tier 2. <strong>(Rank 3)</strong> You can choose from the Companion Statistics up to Tier 3. >",-
Blessing of Nature,Nature,1,2,Medium (8),Touch,singular,"You bless a creature with the magical power of nature, whereby plants and animals act benevolently towards them. On a success, the creature gains the following effects: - You can move through difficult terrain without penalty. - You gain +1 boon on Athletics and Survival rolls. This spell lasts for a long duration.   > **Heightened**   <strong>(Rank 2)</strong> The target gains resistance to acid and poison damage for the spell‘s duration. <strong>(Rank 3)</strong> The target gains resistance to acid, frost, lightning, and poison damage for the spell‘s duration. >",-
Mesh of Vines,Nature,1,2,Medium (8),Medium,singular,"Instantly sprout a mesh of spiked vines, covering the target location. On a success, spiked vines fill an area close to the target location. Target each creature in the area and use your roll’s result vs. their Dodge. <strong>Weak.</strong> Deal +0 damage against each target. <strong>Strong. </strong>Deal +2 damage against each target and they are grappled by the vines. <strong>Critical.</strong> Deal +2 damage against each target and they are grappled and restrained by the vines. The area is also considered difficult terrain. The vines last for a short duration.   > **Heightened**   <strong>(Rank 2)</strong> The vines deal +2/+4/+6 damage against each target instead. <strong>(Rank 3) </strong>The vines deal +4/+8/+12 damage against each target instead. >",-
Purify Water,Nature,1,2,Medium (8),Short,-,"You cleanse and purify water, removing contaminants through natural magic. Choose a body of water within close range of the target location. This spell has no effect on magical liquids or creatures made of liquid. On a success, you remove all poisons, diseases, and other harmful contaminants from the water, making it safe to drink. Any creatures who drink from the water during a short duration after you cast this spell also gain 5 temporary HP.",-
Rock Throw,Nature,1,2,vs. Dodge,Medium,-,"Magically animate a large stone and throw it against your target in range. <strong>Weak.</strong> Deal +4 crush damage. <strong>Strong.</strong> Deal +8 crush damage and the target is pushed close. <strong>Critical.</strong> Deal +12 crush damage, the target is pushed close and falls prone.  > **Heightened**   <strong>(Rank 2)</strong> Deal +6/+12/+18 crush damage instead. <strong>(Rank 3)</strong> Deal +8/+16/+21 crush damage instead. >",-
Sticks to Snakes,Nature,1,2,Medium (8),Close,concentrate,"You throw out a bundle of sticks, which then turn into withering snakes under your control. You must roll a Supply check for materials (Quality 2 or higher) when casting this spell. On a success, you summon a  swarm of snakes at the target location under your control (treat them as a companion for combat). The swarm remains for a medium duration, until dismissed by you, or when killed.",-
Venomous Weapon,Nature,1,2,Medium (8),Touch,"enchant (weapon),  singular","Imbue a weapon with the power of a serpent‘s fangs. If the target is dual-wielding, you can instead target both their held weapons. On a success, the weapon deals +2 poison damage. On a strong or critical hit, the attack‘s target is briefly poisoned. Each creature can suffer the condition from this spell only once per scene. If you target your own weapon, you can make a weapon attack with it as part of casting this spell. This spell lasts for a medium duration.   > **Heightened**   <strong>(Rank 2)</strong> The weapon deals +4 poison damage instead. <strong>(Rank 3) </strong>The weapon deals +6 poison damage instead. >",-
Wild Companion,Nature,1,2,Medium (8),Touch,ritual (hours),"You can’t cast this spell if you haven’t learned the “Animal Companion” talent. You set up a ritual to summon a spiritual beast of the land. As part of casting this spell, you must also spend 100 coins in incense and other sacred ingredients (they are spend even on a failure). Follow the normal rules, described in the “Animal Companion” talent for choosing a form for your animal companion (you can still only control as many animal companions, as you are allowed by the talent). On a success, you summon a spiritual being in your chosen animal form. Apply the following traits to it: - It’s creature type becomes “spirit (primal)” - +1d Spirit, +1d Mind - +1 Resist  You also have a psychic connection to your companion, as long as the two of you are on the same sphere of existence. This connection manifests itself as an intuitive sharing of emotions. You can use this connection to tell your companion what to do and where to go nonverbally. You can also spend your turn meditating to fully experience all senses of your companion. While meditating this way, you are considered unconscious and are unaware of your own body‘s surroundings. Any creature capable of sensing magical auras will notice the primal nature of your companion. The companion remains until killed, but can be re-summoned with another ritual. You can choose the same or a new form for your companion each time you cast this spell.   > **Heightened**   <strong>(Rank 2) </strong>As part of casting this spell, you must spend 200 coins instead. Also apply the following traits to your companion: - It can cast any rank 0 or 1 spells you know. It casts them with it’s Spirit + your Nature. Instead of spending Focus, it can only cast a number of rank 1 spells per day equal to your Nature. <strong>(Rank 3) </strong>As part of casting this spell, you must spend 500 coins instead. Also apply the following traits to your companion: - It can cast any rank 0, 1, or 2 spells you know (rank 1 spells are heightened to rank 2). It casts them with it’s Spirit + your Nature. Instead of spending Focus, it can only cast a combined number of rank 1 or 2 spells per day equal to your Nature.  >",-
Heat Metal,Nature,2,4,vs. Resist,Short,concentrate,"You let a metallic object rapidly increase in temperature, harming anyone touching it. You must be not wearing any armor or weapon primarily made from a metal to cast this spell. Choose any metallic object or creature of up to medium Size. On a success, the target becomes burning hot. Any creature holding or wearing the object suffers +2 fire damage (ignoring AV) at the start of each turn they continue to do so. If the target is a weapon, it imposes +1 bane on attacks with it. If the target is a piece of armor or a helmet, it‘s AV bonus is halved. This spell lasts for a short duration.   > **Heightened**   <strong>(Rank 2)</strong> Choose one: - You can also target objects with up to large Size. - The object inflicts +4 fire damage (ignoring AV) each turn instead. <strong>(Rank 3)</strong> Choose one: - You can also target objects with up to huge Size. - The object inflicts +6 fire damage (ignoring AV) each turn instead.  >",-
